{"complete":true,"failures":[],"fixtures":[{"fixture_id":"safe-noise","formal_backends":{"nuxmv":{"available":false,"reason":"unavailable"},"z3":{"available":false,"reason":"unavailable"}},"metrics":{"original_rules":1,"original_states":2,"original_variables":2,"reduced_rules":0,"reduced_states":1,"reduced_variables":1},"reference":{"equivalent":true,"failure":null,"original":{"counterexample":[],"duplicate_states":1,"states":2,"transitions":2,"verdict":"safe"},"reduced":{"counterexample":[],"duplicate_states":0,"states":1,"transitions":0,"verdict":"safe"},"reduction":{"applicable":true,"assumptions":["selected properties are state safety invariants","transition assignments are simultaneous","omitted rules stutter on every retained variable","rule identifiers are stable witness labels"],"invariant_ids":["safe-remains-true"],"original_fingerprint":"ba1db9667cc68a3efd1dd91f4b800e06f930508508b8325c91fc61ac577249cc","reason":null,"reduced_fingerprint":"de06bf58940eebe10ce22b073aceb79375a4dbafdc20a3484be8a47681f1943f","reduced_ir":{"assumptions":["noise is independent of the selected safety property"],"bound":4,"id":"safe-noise--coi--7a4e62f95280","invariants":[{"description":"Independent noise cannot falsify the safety bit.","expression":{"arguments":[],"kind":"variable","value":"safe"},"id":"safe-remains-true"}],"schema_version":"1","transitions":[],"variables":[{"initial":true,"maximum":null,"minimum":null,"name":"safe","sort":"boolean"}]},"removed_rules":["toggle-noise"],"removed_variables":["noise"],"retained_rules":[],"retained_variables":["safe"],"schema_version":"1","witness_lifting":{"projected_variables":["safe"],"reason":null,"rule_ids_preserved":true,"strategy":"preserved_rule_sequence_with_original_state_replay","validated":null}},"schema_version":"1"}},{"fixture_id":"unsafe-control","formal_backends":{"nuxmv":{"available":false,"reason":"unavailable"},"z3":{"available":false,"reason":"unavailable"}},"metrics":{"original_rules":2,"original_states":3,"original_variables":3,"reduced_rules":1,"reduced_states":2,"reduced_variables":2},"reference":{"equivalent":true,"failure":null,"original":{"counterexample":[{"failed_invariants":[],"rule_id":null,"state":{"control":true,"noise":0,"safe":true},"step":0},{"failed_invariants":["safe-remains-true"],"rule_id":"apply-control","state":{"control":true,"noise":0,"safe":false},"step":1}],"duplicate_states":0,"states":3,"transitions":2,"verdict":"unsafe"},"reduced":{"counterexample":[{"failed_invariants":[],"rule_id":null,"state":{"control":true,"safe":true},"step":0},{"failed_invariants":["safe-remains-true"],"rule_id":"apply-control","state":{"control":true,"safe":false},"step":1}],"duplicate_states":0,"states":2,"transitions":1,"verdict":"unsafe"},"reduction":{"applicable":true,"assumptions":["selected properties are state safety invariants","transition assignments are simultaneous","omitted rules stutter on every retained variable","rule identifiers are stable witness labels"],"invariant_ids":["safe-remains-true"],"original_fingerprint":"99aacfbb7859f2f534671dc25a46a8e3a8ebcda4101690f166b418a57ef61887","reason":null,"reduced_fingerprint":"25972b8b792ad056aef136aa9dfa1467aa6e5641923ae543ce2e4a161b47e35f","reduced_ir":{"assumptions":["the control bit is an exact unsafe-effect abstraction"],"bound":4,"id":"unsafe-control--coi--7a4e62f95280","invariants":[{"description":"The unsafe control transition must produce a witness.","expression":{"arguments":[],"kind":"variable","value":"safe"},"id":"safe-remains-true"}],"schema_version":"1","transitions":[{"assignments":[{"expression":{"arguments":[{"arguments":[],"kind":"variable","value":"control"}],"kind":"not","value":null},"variable":"safe"}],"guard":{"arguments":[],"kind":"constant","value":true},"id":"apply-control"}],"variables":[{"initial":true,"maximum":null,"minimum":null,"name":"control","sort":"boolean"},{"initial":true,"maximum":null,"minimum":null,"name":"safe","sort":"boolean"}]},"removed_rules":["increment-noise"],"removed_variables":["noise"],"retained_rules":["apply-control"],"retained_variables":["control","safe"],"schema_version":"1","witness_lifting":{"projected_variables":["control","safe"],"reason":null,"rule_ids_preserved":true,"strategy":"preserved_rule_sequence_with_original_state_replay","validated":true}},"schema_version":"1"}}],"id":"sled-coi-reduction-v1","protocol_fingerprint":"996a03e2c40262f1170beb302d6ff08e544b17e0b2395eec785c5d494075e863","schema_version":"1","summary":{"available_formal_backends":[],"fixtures":2,"fixtures_with_measurable_reduction":2,"reference_verdict_agreements":2}}
